category;position;description
Backend;Software Architect .NET;"b""Stationary work, Remote work Project you can join Currently we are looking for a Software Architect .NET who will join an international team responsible for system specifying and distributing individually configured embedded software to concerned production sites. The main responsibility of the system is to automatically derive and provide the specified bill-of-material and the tool operation list for a hard individual product to be built in selected factories based on a production order. Main tasks for Software Architect .Net will be to understand and meet the customer's requirements in business scenarios, follow Volvo Group target architecture, ensure integrity of the overall architecture, reconcile conflicting concerns from different stakeholders, design and maintain solution architectural artifacts (e.g. solution architecture design, integration maps, infrastructure models), documentation and communication of architectural assumptions, requirements and designs to both technical and non-technical audience. Requirements Good knowledge of all aspects of the software engineering process Have several years\xe2\x80\x99 documented experience of assignments in .Net architecture Practical knowledge of Design Patterns and best practices Excellent knowledge of .Net Technology Excellent communication and presentation skills in English, both written and spoken Proven leadership skills with considerable social competence Collaboration mind-set within and across teams International experience will be considered an advantage Technologies necessary on this position .Net - Excellent Design Patterns - Excellent Foreign languages English - Excellent"""
Mobile & Embedded;Software Architect � Eden-NET;     Nokia Wroc�aw / Oferty pracy    Software Architect � Eden-NET    Position description and career opportunities What we�are creating is world leading Self Organizing Networks (SON) solution called Eden-Net, which simplifies and automates deployment and optimization of multi-technology (GSM, WCDMA, LTE, 5G) and multivendor heterogeneous networks. It offers a�large selection of algorithms which automatically optimize mobile networks, increase theirs� capacity and reliability. We�re currently looking for Software Architects that could join our ranks and support development of our bleeding edge product. Apart from open-mindedness and ability to�think outside of the box, it�s crucial for us that you�ll have solid experience in Python or Java, willingness to�develop further in both and to�lead development team in cooperation with internal and external project stakeholders. What we�offer in return is an opportunity to�participate in research and development activities in emerging technology, friendly working environment and much, much more. Hope to�hear from you soon!    Our expectations   BSc or MSc degree in Computer Science, Telecommunications, Software�Engineering or similar technical leader with excellent teamwork and problem solving skills has excellent coding skills in Python and/or Java with a proven track record knows and applies OOP principles, clean code and good programming practices on daily basis familiar with UNIX or Linux understands system design, data structures and algorithms able and willing to learn new technologies fluent English     Bonus points   Celery, SQLAlchemy, uWSGI Tomcat, NGINX, GWT, Maven MySQL, PostgreSQL, Redis RedHat Bamboo, GIT, Stash, Confluence, Jira    
Mobile & Embedded;Senior System Engineer, Baseband Platform;     Nokia Wroc�aw / Oferty pracy    Senior System Engineer, Baseband Platform    Position description and career opportunities The baseband platform architecture organization in Wroclaw is a�strongly growing team in the Mobile Networks business group of Nokia Networks that is responsible to�define the baseband processing and base station architecture of our products. This includes the optimization of radio algorithms, the dimensioning of the hardware, software and system-on-chip components of our products, the mapping of the algorithms to�the defined product architecture, and the preparation of the product implementation as such. Within this organization, a�newly created team in Wroclaw looks into the assessment, optimization and specification of physical layer (PHY) and medium access control (MAC) algorithms for our LTE and 5G products, with a�particular emphasis on 5G and IoT. The team collaborates closely with related research projects in Nokia Bell Labs, Nokia�s standardization delegates, product management, key customer teams, and of course the product development teams that take the work forward and perform the actual implementation of the specified algorithms. The team is in a�unique position in the way that it is in the heart of Nokia�s product development for 5G, but still provides the room for substantial product innovation. Within the team, a�wide range of roles from junior to�senior are available, depending on the candidates� background involving, e.g., project management, support of 3GPP contributions, or direct interaction with customers.    Our expectations   M.Sc. in electrical engineering, computer engineering or similar technical field (a Ph.D. is a plus) solid knowledge of the physical layer and/or MAC layer of cellular communication systems, in particular related to baseband signal processing. Knowledge on 5G and/or a detailed insight into 3GPP standardization is a plus. experience in modeling PHY and MAC schemes and assessing their performance through MATLAB simulations an additional background in FPGA programming, RF circuit design, modeling and compensation of RF impairments, or a general understanding of SW, HW and SoC design is a plus good communication in English (both written and spoken)    
Mobile & Embedded;Software Architect (5G);     Nokia Wroc�aw / Oferty pracy    Software Architect (5G)    Position description and career opportunities Our 5G Feature team develops 5G technology, and play a�key role in future communication networks. We�plan to�deliver 5G hardware and software to�telecommunication market. We�have vision, business plans, know � how, customers, several working demos and experience which makes our goal realistic. If you are skilled and ambitious software architect who could contribute to�our plans � join us. You will create software architecture for 5G features, participate in technical studies, and solve complex engineering problems in different technology areas. You will be responsible for performance analysis, creation and evaluation of technical concepts taking into consideration customer feature analysis. You will also consolidate input from different areas (SW and HW development, system architecture, Integration and verification). It is an opportunity to�play a�key role in shaping the way our next generation products are developed, providing technical guidance and making sure that the architectural proposals made by�you are suitable for the implementation of our end-user needs.    Our expectations   excellent understanding of C++ object oriented programming experience in large-scale software development experience in software architecture for embedded and distributed systems experience in code profiling and optimization customer and task oriented attitude high time management skills good English language skills     Bonus points   knowledge in mobile network technologies and standards degree in Telecommunication    
Mobile & Embedded;Embedded Software Architect;     Nokia Wroc�aw / Oferty pracy    Embedded Software Architect    Daily activities You will be responsible for requirement analysis, software design and implementation of industrial grade software on embedded real-time platform. You will take responsibility for business-critical aspects, balancing technical and business benefits.    We work with   C++11/14/17 GCC, Clang Linux Yocto/Bitbake Testing frameworks JIRA Version control and code review systems Continuous integration systems     Our expectations   Master�s or Bachelor�s degree in Engineering, Telecommunications, Computer Science, Software technology or equivalent education expert level in C/C++ development, analysis and design of complex commercial software products experience in creating advanced software architecture, redesigning and refactoring experience in embedded systems programming (HW resources constraints: limited memory, CPU) including HW debugging, multithreading and multiprocessing (IPC, parallel computing) expertise in algorithm optimization, code profiling, analysis of memory usage violations and real-time performance enhancing knowledge of Unified Modeling Language (UML) good practical knowledge of STL and boost libraries design Patterns (thread-safe oriented) experience with SW and HW debugging tools (gdb, JTAG, lauterbach) strong analytical skills effective teamwork skills good communication in English (both written and spoken) ready to relocate to Wroclaw, living in or nearby        Requirements engineering    
Backend;Senior C++ Engineer;     Nokia Wroc�aw / Oferty pracy    Senior C++ Engineer    Daily activities: You will be responsible for software design, implementation, analyzing and solving complex engineering problems and hitches in radio technologies area. You will create and review requirements for functional, design and interface specifications based on system and HW specifications. Your scope of work will include daily cooperation with project managers, architects and other technical experts for planning activities. You will also coach and lead other teams in solving engineering problems.    We work with   C++11/14/17 GCC, Clang Linux Yocto/Bitbake Testing frameworks JIRA Version control and code review systems Continuous integration systems     Our expectations   Master�s or Bachelor�s degree in Engineering, Telecommunications, Computer Science, Software Technology or equivalent education excellent coding skills proficiency in embedded C++ object oriented programming extensive experience in designing, developing and testing C++ software excellent understanding of system design, data structures and algorithms proficiency in effective usage of design patterns Python/Bash is an advantage analitical thinking teamwork skills good communication in English (both written and spoken) ready to relocate to Wroclaw, living in or nearby  � Don�t see a technology you love? Tell us why we should know about it!   
Backend;Junior C++ Engineer;     Nokia Wroc�aw / Oferty pracy    Junior C++ Engineer    Daily activities: You will be a�Junior C++ Software Engineer working on a�SW for Base Station. You will be a�member of scrum team consisting of programmers, tester and specificators. The team applies good development practices using e.g. STL, BOOST, Design Patterns, is responsible for requirements analysis, test cases design, implementation and execution. You will have an opportunity to�constantly develop your skills in IT and Telecommunications domains. You will work in a�flexible and friendly multicultural environment.    We work with   C++ OOP STL, BOOST Linux/Unix     Our expectations   Master�s or Bachelor�s degree in Engineering, telecommunications, Computer Science, Software technology or equivalent education knowledge of C++ familiarity with object oriented programming STL analytical thinking teamwork skills good communication in English (both written and spoken) ready to relocate to Wroclaw, living in or nearby   Don�t see a technology you love? Tell us why we should know about it!   
Backend;C++ Engineer;     Nokia Wroc�aw / Oferty pracy    C++ Engineer    Daily activities: You will be responsible for software design, implementation, analyzing and solving complex engineering problems and hitches in radio technologies area. You will create and review requirements for functional, design and interface specifications based on system and HW specifications. Your scope of work will include daily cooperation with project managers in planning activities. �    We work with   C++11/14/17 GCC, Clang Linux Yocto/Bitbake Testing frameworks JIRA Version control and code review systems Continuous integration systems     Our expectations   Master�s or Bachelor�s degree in Engineering, Telecommunications, Computer Science, Software Technology or equivalent education strong coding skills expertise in algorithm optimization, code profiling and in analysis of memory usage violations Python/Bash is an advantage analytical thinking teamwork skills good communication in English (both written and spoken) ready to relocate to Wroclaw, living in or nearby  � Don�t see a technology you love? Tell us why we should know about it!   
Backend;C++ DSP Embedded Developer;     Nokia Wroc�aw / Oferty pracy    C++ DSP Embedded Developer    Daily activities: You will be responsible for software design, implementation, analyzing and solving complex engineering problems and hitches in radio technologies area. You will create and review requirements for functional, design and interface specifications based on system and HW specifications. Your scope of work will include daily cooperation with project managers in planning activities.    We work with   C++11/14/17 GCC, Clang Linux ARM/DSP processors Linux or embedded RTOS Yocto/Bitbake Testing frameworks JIRA Version control and code review systems Continuous integration systems     Our expectations   Master�s or Bachelor�s degree in Engineering, Telecommunications, Computer Science, Software Technology or equivalent education excellent coding skills expertise in algorithm optimization, code profiling and in analysis of memory usage violations experience in creating multi-core embedded projects Real time operating systems knowledge Python/Bash is an advantage analytical thinking teamwork skills good communication in English (both written and spoken) ready to relocate to Wroclaw, living in or nearby  � Don�t see a technology you love? Tell us why we should know about it!   
Backend;C Embedded Software Engineer;     Nokia Wroc�aw / Oferty pracy    C Embedded Software Engineer    Daily activities: As a�SW Engineer you will be part of an agile development team which is responsible for specifying, planning, implementing and delivering high quality, best in class, SW for BTS. You may work also outside of own process area on technical issues. You will be solving complex engineering problems in your own technology areas. Your background and areas of interest will be take into account when defining your main tasks and responsibility areas. Your tasks and duties will include: requirements analysis, software design, implementation of new functionalities and testing activities. You will also be in charge of writing specifications and creating documentation for the relevant part of the software. Other key tasks will include code re-factoring and optimization, code maintenance, and bug corrections. You will participate in work amount estimation in your own area. To�succeed in this role, you need to�be an open-minded professional with good organization skills, strong commitment to�quality and a�flair for innovative thinking. If you also feel yourself as a�technical leader, leading a�sub project and everything related to�that kind of work, don�t hesitate to�apply for this position.    We work with   C language ARM/DSP processors Linux or embedded RTOS     Our expectations   Master�s or Bachelor�s degree in Engineering, Telecommunications, Computer Science, Software Technology or equivalent education clean Coding C programming skills SW/HW debugging skills HW related SW understanding practice in u-boot development 3+ years� experience in Linux kernel/driver�s development deep experience in programming (min. 3 years� commercial development in C language) professional experience in creating multi-core embedded projects understanding of Linux user space program development Real time operating systems knowledge strong communication skills and ability to work in international teams knowledge on version control software (git/svn) analitical thinking teamwork skills good communication in English (both written and spoken) ready to relocate to Wroclaw, living in or nearby  � Don�t see a technology you love? Tell us why we should know about it!   
Business Intelligence;Senior Data Scientist;     Nokia Wroc�aw / Oferty pracy    Senior Data Scientist    Daily activities On daily basis, you will identify the internal and the external properties and processes which govern business performance. It will be realized by�finding and understanding of data resources suitable for strategy formulation and explanation of business hypotheses, proposing new metrics for qualitative and quantitative assessment of business processes performance, researching, designing, implementing and deploying full-stack scalable data analytics visions to�challenge various business issues and opportunities. You will deliver key analytical actions, e.g. preparation of data sets for exploration and visualization, selection of analytical methods and tools adequate to�inherited properties of the complex system and data set, but you also should be able to�draw reports and to�present results for management and internal use. Since you will work with cross-functional team members, you will communicate the logic of your processing flow in the form of specification for algorithmizing and automation of problem solving with the use of data science methodology. Finally, in senior position you will provide the expertise on mathematical concepts of business problem solving, and serve as the leader for the projects and project teams within the area of techno-economic data processing.    We work with:   variety of data types and sources advanced Analytics methods, from statistical modeling to Machine Learning methods Python / R / Matlab Microsoft Azure and Microsoft Cortana SQL database tools     Our expectations:   PhD or Master�s Degree in computer science or related fields, e.g. mathematics, physics, engineering or economic sciences at least 4 years of experience in data science field excellence in analyzing large, complex, multi-dimensional data sets with a variety of analytic methods (math, statistics, machine learning, etc.) and software tools (e.g. scripting in Matlab, Python, R) familiarity with database technologies and querying languages strong analytical, problem solving and synthesis skills, intellectual curiosity and industry knowledge organizational skills and ability to work under time pressure and with complex tasks highly responsible person who act independently within his/her own responsibility area teamwork skills willingness to travel worldwide good communication in English (both written and spoken) ready to relocate to Wroclaw, living in or nearby    
Other;Commercial Development and Programs Manager;     Nokia Wroc�aw / Oferty pracy    Commercial Development and Programs Manager    Daily activities Commercial Management organization plays a�key role in achieving NOKIA�s business targets and commercial strategy definition. It consists of experts with various background including finance and technical fields who constantly analyze market trends and customers need to�make best business decision to�secure long-term success.  In this position, you will be a�part of Tools and Automation team within Commercial Management and you will be responsible for enhancing and optimization of all tools used within Commercial Management. �    We work with   Microsoft Excel VBA SharePoint and Office365     Our expectations   Master�s or Bachelor�s degree in economics, financial or engineering at least 2 years of experience strong knowledge of MS Excel and VBA programming skills preferred organizational skills and ability to work under time pressure and with complex tasks highly responsible person who act independently within his/her own responsibility area good communication skills background in pricing would be as an advantage problem solving and synthesis skills analytical thinking skills teamwork skills good communication in English (both written and spoken) ready to relocate to Wroclaw, living in or nearby    
Business Intelligence;Data Architect / Senior Python Developer;     Nokia Wroc�aw / Oferty pracy    Data Architect / Senior Python Developer    Position description and career opportunities NOKIA MN Commercial Management is looking for experienced and highly skilled Data Architect / Database Administrator / Data warehouse Developer, with several years of professional experience in MS SQL Server and T-SQL. Commercial Management organization plays a�key role in achieving NOKIA�s business targets and commercial strategy definition. It consists of experts with various background including finance and technical fields who constantly analyze market trends and customers needs to�make best business decisions to�secure long-term success.  If you are interested in joining of international and dynamic team consisting of passionate people to�work with hundreds of gigabytes of data to�by analyzed on weekly basis and making impact to�global company commercial success � then this position is for you. In this position, you will be a�part of Analytics Solutions and Automation team within Commercial Management and you will be responsible for design and development of advanced Python based applications to�collect, store and deliver most optimal datasets to�our Business Analysts to�perform their analyses.    Main responsibilities:   Designing and development of Python applications and scripts to support various MN Commercial Management data needs  Optimizing existing applications, performance and security Integration of new data sources and processing chains Development of scripts for advanced data processing Creation of views and interfaces for data stakeholders Implementation of user interfaces and automation for some of the domains     Requirements:   Several years of professional experience in Python development Expert knowledge with broad variety of Python libraries, especially for data processing and analysis (like Python Pandas) Very good knowhow about relational and nonrelational databases Fluency with Linux / Bash operations Experience with R, PowerBI and PowerQuery would be a plus Strong analytical, problem solving and synthesis skills University degree Fluent in Business English (both written and spoken) Organizational skills and ability to work under time pressure and with complex tasks Team player and good communication skills Highly responsible person who act independently within his/her own responsibility area    
Business Intelligence;Data Architect / Database Administrator / Data warehouse Developer;     Nokia Wroc�aw / Oferty pracy    Data Architect / Database Administrator / Data warehouse Developer    Position description and career opportunities NOKIA MN Commercial Management is looking for experienced and highly skilled Data Architect / Database Administrator / Data warehouse Developer, with several years of professional experience in MS SQL Server and T-SQL. Commercial Management organization plays a�key role in achieving NOKIA�s business targets and commercial strategy definition. It consists of experts with various background including finance and technical fields who constantly analyze market trends and customers needs to�make best business decisions to�secure long-term success.  If you are interested in joining of international and dynamic team consisting of passionate people to�work with hundreds of gigabytes of data to�by analyzed on weekly basis and making impact to�global company commercial success � then this position is for you. In this position, you will be a�part of Analytics Solutions and Automation team within Commercial Management and you will be responsible for design, development and administration of our databases and warehouses built on several MS SQL Server instances to�collect, store and deliver most optimal datasets to�our Business Analysts to�perform their analyses and create outstanding PowerBI dashboards in Azure service.    Main responsibilities:   Designing database and data warehouse structure to support various MN Commercial Management data needs  Optimizing existing databases, performance and security Integration of new data sources Development of T-SQL scripts for advanced data processing Creation of views and interfaces for data stakeholders Implementation of advanced security solutions     Requirements:   Several years of professional experience in data design, processing and warehousing Expert knowledge in MS SQL Server and T-SQL Very good knowhow about database administration, performance optimization and security aspects Fluency with Windows 2012 Server operations Experience with Microsoft Azure and/or PowerBI and PowerQuery would be a plus Strong analytical, problem solving and synthesis skills University degree Fluent in Business English (both written and spoken) Organizational skills and ability to work under time pressure and with complex tasks Team player and good communication skills Highly responsible person who act independently within his/her own responsibility area    
