category;position;description
Backend;Senior PHP Developer @; MySQL    PHP 7.1    Symfony    Bitbucket    Composer    Docker    Elasticsearch    RabbitMQ    Teamcity    English office language International Paid holidays with B2B contract Skiing weekend in Switzerland Clean code    PHP    SOLID    Unit testing    Continuous Integration    Design patterns mastery    Domain driven design    Bash    Infrastructure monitoring    Mobile app backend    REST API development    Symfony    English    Polish    Engaged in Warsaw PHP community Enjoys coding Lives in warsaw Plays cards against humanity
Backend;Senior Python Developer @; Golang    PHP7    Python    Code review Continuous Integration everyday standup, planning no dress code peer review code retrospective, 1-2 week sprints, dem... Scrum Django    Flask    Python    Golang    English    Additionally, we appreciate Elastics...
Backend;PHP Developer @; JSON    Laravel    PHP 7    Pixijs    Slim    Webpack    Angular.js    Bootstrap    CSS    Gulp    HTML    Javascript    Memcached    Node.js    Phraser    Redis    SASS    WebGL    Websockets    Lumen    Vue.js    flat structure R&D CSS    HTML5    JavaScript    Websockets    Angular.js    Pixijs    Webpack    Memcached    Node.js    Phaser    Redis    SASS    MySQL    English   
Backend;.NET Developer @; .NET    C#    MSSQL    Oracle    VB.NET    WPF    MVVN    PostgreSQL    .NET    MVVM    WPF    English   
Backend;Java Developer @; Elasticsearch    mysql    Spring framework    Hibernate    Java    lucene    memcached    Varnish ESI    Java    mysql    Spring framework    Elasticsearch    Hibernate    Recommendations engine    apache lucene    apache velocity    Map Reduce    memcached    Varnish    English    Polish   
Backend;Oracle DB Developer @; Oracle DBMS    PL/SQL    Oracle DBMS    PL/SQL    MicroStrategy    MS .Net    MS SQL    Pentaho    Polish    English   
Backend;Java Developer @; Guice    Java    Maven    Web Services    WebSphere8    XML    Scala    SQL    Java    Git    Maven    SQL    Web Services    Agile experience    Dependency Injection    Jenkins    WebSphere8    Polish    English   
Backend;Python Developer @; Django    PostgreSQL    Python    Celery    Django REST framework    HTTP protocol    MySQL    RESTful API    Amazon AWS    Ansible    Docker    Flask    MongoDB    Nginx    RabbitMQ    Redis    SQLite    Tornado    Agile Budget on education Dedicated DevOps/Admins Dedicated PMs, POs, SMs Flexible working hours Good atmosphere Real influence on the project Small teams Django    Python    SQL    RESTful API design    Linux    English   
Backend;Junior Java EE Software Developer @; HTML    Java    JSP    SQL    DB2    IBM Commerce    Javascript    REST    WebSphere Application Server    XML    Complex eCommerce projects International project & team Nordic working culture Unique working atmosphere Java    JSP    SQL    IBM Commerce    English    Eager to learn Team player Minimum 2 years of relevant experience
Backend;Java EE Software Developer @; Java    HTML    JSP    SQL    DB2    IBM Commerce    Javascript    REST    WebSphere Application Server    XML    Complex eCommerce projects International project & team Nordic working culture Unique working atmosphere Java    JSP    SQL    IBM Commerce    English    Eager to learn Team player Minimum 2 years of relevant experience
Backend;Node.js Developer @; Node.js    REST    SQL    TypeScript    AWS    MongoDB    direct contact with client free english lessons team behind Mobiconf conference chillout room with table soccer, pin... flexible working hours international team / projects possibility to spend two days a week... training budget (3000 PLN per year) unforgettable company trips EcmaScript 6    REST    TypeScript    Bacon.js    Functional programming    RxJS    Socket.io    Git    AWS    Jest    Mocha    SQL    Elasticsearch    MongoDB    English   
Backend;Senior PHP Developer @; MySQL    PHP 7.1    REST API    Amazon Web Services    Docker    Laravel    MongoDB    nginx    chillout room with table soccer, pin... direct contact with client flexible working hours international team / projects possibility to spend two days a week... team behind Mobiconf conference training budget (3000 PLN per year) unforgettable company trips design patterns    HTTP/REST API    Laravel    MySQL    PHP 7.1    Git / Mercurial    TDD    AWS    Docker    Elasticsearch    MongoDB    Redis    rabbitMQ    Shell scripting    English   
Backend;Java Developer @; Java    Spring    SQL    Webservices    Hibernate    Tomcat    SOLR    Close to subway Flexible hours Fruit thursdays Java    Spring    Hibernate    JDBC    Tomcat    Linux    JSON    REST    SOAP    Webservices    XML    SWAGGER    WSDL    Polish    English   
Backend;Senior Java Developer @; Java    Hibernate    JavaScript    MVC    Oracle SQL    Spring    Java    JavaScript    MVC    Oracle SQL    Spring    English   
Backend;Senior Software (Python, Django) Engineer @; Django    PostgreSQL    Python    JavaScript    A chance to build a large system fro... A creative work atmosphere and quick... Competitive compensation package No corporate nonsense, no stupid mee... PosgreSQL    Python    Django    JavaScript    Linux fundamentals    Configuration management ...    Experience with CI/CD    Information retrieval    Machine learning    Natural language processing    English   
Backend;Backend Scala Developer @; Scala    Akka    Cassandra    Elastic Search    Kafka    MongoDB    Play    RabbitMQ    Akka Cluster    Java    NodeJS    Python    Choose the right tool for the problem Constant learning Contract first Flat structure Flexible working hours Free fruits Functional programming Global clients Great location High quality Internal trainings Regular team events Table football Akka    Functional Programming    Microservices    NoSQL    Akka Cluster    Message Queue    Architecture    Blogging    Conference speaker    Machine Learning    Spark    English   
Backend;Software Engineer @;" Hybris    Java 7/8    Spring Core    Angular    guava    JSP    JUnit    Mockito    REST    Solr    Spring Integration    Spring MVC    Spring WS    swagger    tomcat    Apache    Cucumber    Groovy    Jackson    JAXB    JMeter    jQuery    MySQL / Percona    Oracle    Selenium    Spock    Spring Batch    wro4j    ZK Framework    atmosphere B2B as an option big and known customers experienced team no ""big bosses"" young team Java 7/8    Spring Core    Spring MVC    Hybris    JUnit    Mockito    Spring WS    Angular    JMeter    JSP    Solr    Spring Integration    English   "
Backend;Software Engineer @;" Hybris    Java 7/8    Spring Core    Angular    guava    JSP    JUnit    Mockito    REST    Solr    Spring Integration    Spring MVC    Spring WS    swagger    tomcat    Apache    Cucumber    Groovy    Jackson    JAXB    JMeter    jQuery    MySQL / Percona    Oracle    Selenium    Spock    Spring Batch    wro4j    ZK Framework    atmosphere B2B as an option big and known customers experienced team no ""big bosses"" young team Java 7/8    Spring Core    Spring MVC    Hybris    Spring Integration    JSP    JUnit    Mockito    Spring WS    Angular    JMeter    Solr    English   "
Backend;Team Lead Java Developer @; ESB    Fitnesse    Git    Gradle    Hibernate    IntelliJ    Java 8    JMS    JUnit    Maven    RMI    Spring    SQL    Swing    Web Services    E-learning platform Employment contract or B2B Flexible working hours Full SDLC Home office International teams No dress code Hibernate    Java 8    JUnit    Spring    Web Services    Git    Gradle    Maven    English    Polish   
Backend;C++/C# Developer @; C#    C++    Linux    MS Windows    STL    TCP/IP    Oracle PL/SQL    SQL    Java    Airlines Flat structure Flexible working hours Home office International environment No dresscode SaaS architecture C#    C++    STL    Linux    MS Windows    TCP/IP    SQL    Java    Jira    Oracle    English    Polish   
Backend;.NET Developer @; .NET 4.6.2    nHibernate    MSSQL    MVC 5    Angular 4.3    OWIN    WebApi    Xamarin    .NET    C#    MSSQL    Angular    AngularJS    Xamarin    Polish   
Backend;Java Developer @; Hibernate    Java 6-8    Jenkins    Spring    Akka    Camel    Gradle    JavaScript    Maven    WebLogic    Oracle    flat structure international team low-level bureaucracy trips to Denmark Engineering/Bachelor Tech...    good understanding of obj...    Java    Hibernate    Java EE    Spring    Git    JavaScript    English    soft-skills
Backend;Junior PHP Developer @; GIT    HTML5    Javascript    PHP    SASS    MySQL    Career growth Cut The Mustard in-house Packhelp (zapakuj.to) in-house Super office Fruits Wednesday CSS    HTML5    PHP    SASS    Gulp    Webpack    Grunt    Laravel    React.js    Symfony    English    Polish   
Backend;Senior C++ Developer @; C++    Linux    Self-driving vehicles    Android    CAN bus    Qt    RTOS    flat structure international project international team work with global technology leader C++    Linux    Android    Scrum    Advanced AI algorythms    CAN bus    Qt    RTOS    large projects experience    English    experience with international teams ... positive attitude strong communication skills very good English
Backend;Ruby on Rails Developer @; Amazon Web Services    Angular    CSS    HTML    Node.js    PostgreSQL    React    Ruby on Rails    Android    iOS    PHP    Symfony    PostgreSQL    React    Ruby on Rails    Amazon Web Services    English   
Backend;WooCommerce Plugin Developer @; GitLab    Slack    TestLink    Trello    WooCommerce    Scrum WooCommerce    WordPress Plugin API    Coding Standards DRY/SOLI...    Databases    GIT    HTML/Sass    JavaScript    PHP 7    Task runners (i.e. Grunt)    WordPress APIs    WP-CLI    JS framework    TDD    Contributes to opensource...    PM skills    SCRUM / Agile    Polish    English   
Backend;Django Developer @; AMQP    Django    JavaScript    PostgreSQL    VueJS    WebSockets    SCSS    Webpack    international team Celery    Django    AMQP    PostgreSQL    SQL    WebSocket    JavaScript    VueJS    Microservices    English   
Backend;Ruby on Rails Developer @; Ruby on Rails    AWS    Javascript    Postgresql    Vue.js    ElasticSearch    Elixir    ES6    GitHub    MySQL    Phoenix Framework    ReactNative    Redis    Ruby on Rails    JavaScript    Postgresql    Vue.js    Polish   
Backend;ETL Developer @; ETL Informatica PowerCenter    Oracle / MS SQL Server    Pentaho    PL/SQL or SQL    SSIS    Python, Unix scripting    SAP Business Objects    Spotfire    Tableau    Informaica PowerCenter    Tableau    English   
Backend;Back-End Engineer @; AWS    Go    Python    PHP    Ansible    Docker    RabbitMQ    full-stack product teams we work on our own product At least 1 year of commer...    Design knowledge (pattern...    Great knowledge of at lea...    Writing clean code    Automated testing    Go    MySQL/ Postgres    Python    PHP    English B2    Able to discuss, admit to mistakes a... Passionate about learning Treating technologies as tools, not ...
Backend;Java Developer @; Angular 2    Docker    Gitlab    Gradle    Java 8    Jenkins    Jira    Linux    Liquibase    Marathon    Mesos    Microservices    Netflix OSS    PostgreSQL    Spring Boot    Spring Cloud    Webservices Rest    Hibernate    Selenium    Fresh technologies Intellij IDEA Hibernate    Java 8    Spring    Linux    Microservices    DDD    Netflix OSS    OAuth2    Spring Cloud    Angular 2    Python    English   
Backend;GWENT Web Developer @; CI    Docker    GIT-flow    MySQL    OAuth2    PHP7    RabbitMQ    Redis    REST    Symfony    Varnish    ElasticSearch    Go    Sphinx    HTML/CSS    big scale flat structure global project international team online game MySQL    PHP7    RabbitMQ    REST    Symfony    Docker    Experience working in an ...    Go    OAuth2    Redis    Varnish    ElasticSearch    HTML/CSS    English    An overwhelming desire to code the b...
Backend;PHP Developer @; PHP    Java    PHP    SOLID    TDD    Continous Integration    Java    Polish    English   
Backend;Software Engineer @; Spark    Python    Scala    advanced R&D BigData distributed systems file systems flat structure for willing trips to Japan/Silicon V... international team Machine Learning scalable systems CS education    C++    Java    Python    Scala    Spark    Polish    English    ability to write clean code creativity parallel programming team work
Backend;Java Developer @; Hibernate    Java 8    Spring    Angular    Groovy    SQL    Angular 2    Gatling    Javascript    Solr    Typescript    International team R&D department Hibernate    Java    Spring    Angular    Groovy    Javascript    Jenkins    SQL    DB2    Docker    Gatling    Sonar    Typescript    Polish    English    abiity to work independently open-minded problem solving skills
Backend;Lead Scala Expert @; Java    Scala    Akka    NoSQL    Play    Brand New Office Career Progression Greenfield Projects High Volume Data International Teams Latest Technologies Sociable Teams Java    Scala    Akka    Play    Spring    Scrum    Spark    Agile    REST    English    Great Communicator Team Player Hamburg
Backend;Java Cloud Developer @; Java    Akka    AMQP    Docker    Linux    OSGi    Cassandra    Elasticsearch    Groovy    Redis    REST    Scala    High Availability International projects Internet of Things (IoT) Microservices NoSQL Performance SaaS Scalability Java    Concurrent programming    Linux    Akka    Git    Groovy    Scala    SQL    English   
Backend;Python Developer @; Django    HTML5/CSS3    JavaScript    PostgreSQL    Python    REST    C    NoSQL    Erlang    agile flat structure flexible working hours innovation driven environment knowledge sharing modern office building technology agnosticism Django    PostgreSQL    Python    Git    JavaScript    REST    NoSQL    English    ability to work independently creativity knowledge of distributed architecture out of the box thinking strong algorithmic skills timeliness
Backend;Software developer | Trading exchange Deve... @; blockchain    Elixir    Ethereum    Solidity    cryptography    >=3 yrs experience    order book algorithms    trading exchanges archite...    algorithms    data structures    Blockchain    Elixir    Erlang    Ethereum    functional programming    Solidity    decentralized exchanges    Golang    Python    English   
Backend;Regular Java Engineer @; Java    Design/Architecture    NoSQL    RxJava    Vert.x    Ansible    AWS    Docker    Scala    Contributions to Open Source Engineering spirit Global range system Greenfield project High availability Low latency Microservices Peak 3000 TPS You ship it, you run it Zero-downtime deploy Java    Async programming    DevOps skills    AWS (or cloud) experience    NoSQL    Scala (or other functiona...    English    Experience in working for Open Source
Backend;Microservice Java Developer @; Docker    Java 8    Kafka    Microservices    Redis    MongoDB    Elastic Search    Grafana    Kibana    Kubernetes    Brand new product Flat Structure Project from the scratch Java    Container/Docker    Networks    Linux    NoSQL Databases    English    Team Work
Backend;Senior Java / Tech Lead Engineer @; Java    Javaslang    RxJava    Vert.x    Ansible    AWS    Design/Architecture    Docker    NoSQL    Groovy    Scala    Engineering spirit Global range system Greenfield project High availability Low latency Microservices peak 3000 TPS You ship it, you run it Zero-downtime deploy Java    Async programming    Designing (architecture) ...    Distributed systems/compu...    DevOps skills    AWS (or cloud) experience    NoSQL    Scala (or other functiona...    English    Experience in working for Open Source
Backend;Big Data/Scala Engineer @; Hive    Spark    Hadoop    NoSQL    Scala    Contribution to Open Source Engineering spirit Flat structure Distributed systems/compu...    Java or Scala    Hadoop    Spark    Hortonworks/other big dat...    Machine Learning/AI    English    Passionate about building data-drive...
Backend;JAVA Developer @; JAVA    JAVA 8    Spirng    Hibernate    HTML/ CSS    JavaScript    JAVA    OOP    Spring    SQL    JPA/ Hibernate    JUnit, Mockito    Maven,  Gradle    CI    HTML5/ CSS    JavaScript    JEE    Spock, Sonar, Checkstyle    AngularJS/ ReactJS/ Ext-js    Spring Boot    WebService, REST    English   
Backend;Senior Big Data / Scala Engineer @; Hive    Spark    Hadoop    NoSQL    Scala    Contribution to Open Source Great culture Hadoop    Scala    Spark    Distributed systems/compu...    Hortonworks/other big dat...    Java    Machine Learning/AI    NoSQL    English    Experience in working with Open Source Passionate about building data-drive...
Backend;Java Developer @; Java    Jboss    J2EE    Git/Gitlab    Hudson/Jenkins    Jira    Java    J2EE    Jboss    XML    Git/Gitlab    Hudson/Jenkins    Jira    Linux    Polish    English   
Backend;Java Developer @; Java    JPA    Spring    GIT    Hibernate    Javascript    REST    SOAP    JBoss    Maven    brand new office career progression flat structure international clients international projects QA Java 8    Hibernate    Spring    Javascript    JBoss    Maven    Scrum    English    good communication skills
Backend;Linux Platform Engineer @; Bash    Linux Server    Python    VMWare    Perl    Bash    Linux server    Python    Perl    Power Shell    Security aspects in Linux...    TCP/IP    Active Directory    Clustering    GIT, Stash, JIRA    KVM, Docker, AWS    English   
Backend;Mid-Level Java Engineer @; Design/Architecture    Java    NoSQL    RxJava    AWS    Vert.X    Project Carvallar Contribution to Open Source Engineering spirit Unconventional Project Java    Async programming    Designing (architecture) ...    Distributed systems/compu...    DevOps skills    AWS (or cloud) experience    NoSQL    Scala (or other functiona...    English    Experience in working for Open Source
Backend;Regular Java Engineer @; Design/Architecture    Java    NoSQL    RxJava    AWS    Vert.X    Contributions to Open Source Project Carvallar Engineering spirit Unconventional Project Java    Async programming    Distributed systems/compu...    AWS (or cloud) experience    DevOps skills    NoSQL    Scala (or other functiona...    English    Experience in working for Open Source
Backend;Java Developer @; Hibernate    Java/JEE    OracleDB    Spring    spring 4, spring-data, sp...    English    JBoss    Flat structure Great  atmosphere International project The Best IT Employer in Poland  2016... Hiberbate    Java    OracleDB    JBoss    REST    SPA    Spring    SQL    Angular    JavaScript    Scrum    xml, xslt, Apache Fop    Groovy    HTML. CSS    Oracle Service Bus    English    communication skills
Backend;Windows Platform Engineer @; PowerShell    Windows Server    Power Shell    Windows Server    Active Directory    Network Security    TCP/IP    IIS Server    Shell scripts    English   
Backend;Python Expert @; Celery    Django    git    Python    RESTful APIs    AWS    Linux    PostgreSQL    Redis    Cutting-edge technology stack Flat structure Highly qualified team International team Process-based organisation Travel to Los Angeles Django    PostgreSQL    Python    RESTful API    Celery    Frontend    Single Page Applications    English    Eager to learn Highly developed English Team player US visa
Backend;C++ Software Engineer @; C++    GO    STL    Java    Python    Robot    SDN    SDN international clients International team C++    STL    GIT    Java    Linux    Python    GO    Jenkins    Robot    English   
Backend;Java Engineer @; Java 8    Spring    WebServices    Agile    NoSQL    SQL    TDD    AWS    Maven    rxJava    CI/CD Cloud Cool team flat structure Java    Spring    SQL    NoSQL    AWS    JavaEE    Polish    English    learning readiness
Backend;Java Engineer @; AWS    Java    Spring    angularJs    Javascript    JMS    Kibana    Mysql    Distributed architecture Flat structure Clean Code    Java    Spring    AWS    DDD    English   
Backend;PHP Backend Developer @; PHP    PostgreSQL    Consul    ElasticSearch    MongoDB    RabbitMQ    React    Chef    Marathon    Memcached    Mesos    Node.js    Phing    challenging environment flat structure global ambitions startup atmosphere PHP    Software Architecture    SQL    Big Data    Databases    Linux    NoSQL    OOP    Web Applications    ElasticSearch    GIT    MongoDB    Post    English    Polish    ambition experiance reliable self-reliance
Backend;Software Architect @; PHP    PostgreSQL    Consul    ElasticSearch    MongoDB    RabbitMQ    React    Chef    Marathon    Memcached    Mesos    Node.js    Phing    challenging environment flat structure global ambitions startup atmosphere Databases    OOP    PHP    Software Architecture    Big Data    Linux    NoSQL    SQL    Web Applications    ElasticSearch    GIT    MongoDB    Post    English    Polish    ambition experiance reliable self-reliance
Backend;PHP Developer @; MySQL/MariaDB    PHP 7/7.1    Symfony 2.8+    Elasticsearch    MongoDB    RabbitMQ    Reddis    Varnish    Docker    Agile Team FIFA 2017 oriented :) Flat structure Goal oriented Feedback Responsibility MySQL    PHP 5.6    Symfony 2.8+    GIT    PHP 7/7.1    Beanstalkd    Elasticsearch    Microservices    MongoDB    RabbitMQ    Redis    Varnish    English   
Backend;Scala Developer @; Play framework    Scala    AngularJS    MongoDB    Akka    cats    CoffeeScript    Docker    Meteor    MySQL    SQS    TypeScript    continuous delivery flat structure startup atmosphere tdd friendly Clean Code    Scala    MongoDB    Play framework    Akka    AngularJS    AWS    cats    docker    elm    functional programming    property testing    typelevel libs    polish    english   
Backend;Java EE Developer @; Java 7, 8 / JEE    Git / Gitlab    Hudson / Jenkins    Jboss    Spring / Hibernate    Java / JEE    Ruby    English   
Backend;Java Software Engineer @; GIT    Java    Linux    SDN    Python    Business trips to USA international team GIT    Java    Linux    C++    Python    ELK    JBoss    Puupet / Chief / Ansible    English   
Backend;Java Developer @; Java    JMS    JPA/EclipseLink    Oracle    OSGi    SOA    SOAP    Spring    Spring MVC    AngularJS    JSP    REST    Struts 1.x    Synapse ESB    DDD    Java    OOP    TDD    Git    JPA    Spring    OSGi    SOA    SOAP    Weblogic Server    Angular    REST    Struts 1.x    Docker    JVM troubleshooting skills    Polish    English    problem solving skills self-organized �Can do� attitude +1 year experience
Backend;Backend .NET Developer @; .NET    .NET Web API    DDD    Eventsourcing    ServiceFabric    Impact on used solutions International team C#    .NET Web API    DDD    Eventsourcing    ServiceFabric    English   
Backend;Senior GIS Developer @; GIS    Java    Oracle    GIS    Java    Oracle    MCSD    English   
Backend;Junior/Middle/Regular Java Developer @; Java    JPA/Hibernate    REST    Spring    Cloud/AWS    New teams Newest technologies Java    JPA/Hibernate    REST    Spring    Cloud/AWS    English   
Backend;Senior ASP.NET Developer @; ASP.NET    AngularJS    Entity Framework    SQL Server    Azure Services    XUnit    Flat structure Other forms of agreement (B2B, other) asp.net    Git    SOLID    Entity Framework 6    Microsoft Azure    SQL Server    AngularJS    CQRS    Polish    English    4 years of experience
Backend;Java Developer @; Java8    AngularJS    Bootstrap    Git    JavaScript    Jetty    JIRA    MySQL    ORM    Java    JavaScript    English   
Backend;(Senior) Java Developer @; git    hibernate    java    maven    spring    sql    microservices    web services    AWS    application design back-end development telco project Experience with Java    Hibernate knowledge    Spring Framework practica...    Database knowledge    Experience in developing ...    Experience in REST    Javascript    English   
Backend;Back-end Software Developer @; JavaScript    Python    Django    HTML5&CSS3    flat structure international team GIT and branching    happy with teamwork    Javascript, HTML5, CSS3    Python and Linux    SQL/databases    very strong general progr...    Academic degree in Comput...    BigData technologies    Django    Mathematical modelling    Software architecure/design    Tensorflow or other ML fr...    Anything relating to ships    English    EU citizenship
Backend;Devops Engineer @;" Ansible    Docker    GIT    JavaScript    Python    SQL    Puppet    flat structure international team Ansible    Bash    Docker    GIT    Linux (Debian)    Linux system (3 years)    Network administration (3...    Python    SQL    MODBUS    open-source monitoring tools    RS422    RS485    Experience with analog si...    English    ""can-do"" attitude BSc in electronics or computer/softw... communication and interpersonal skills EU citizenship Experience in Support tasks Fast learner Self-motivated"
Backend;Senior Java Engineer @; Java    Akka    Play Framework    AWS    MySQL    SCRUM    international team security is crucial Building web apps    Java    API design    AWS    distributed systems    RDBMS    Scrum    Akka    Elasticsearch    Apache Solr    Hadoop    Kubernetes    Lucene    Machine learning    Microservices    Play Framework    English   
Backend;Python Developer @; PostgreSQL    Python    Docker    Ansible    RabbitMQ    Python    Relational databases    SQL    Ansible    Docker    RabbitMQ    English   
Backend;.Net Developer @; .Net 4.0+    ASP.Net MVC    .Net Core    Domain Driven Design    Entity Framework    NHibertnate    REST Api    SOLID    .Net    ASP.Net MVC    C#    SOLID    .Net Core    Domain Driven Design    Git    NoSQL    REST    SQL    CQRS pattern    Microservices architectur...    English   
