category;position;description
Backend;Senior .Net Developer;"b""The IMM (Internal Model Method) program is a multi-phase, multi-year initiative designed to reduce operational costs for the IB. As the IMM IT Developer you will be part of a team of developers working on several high-demand systems (e.g. EPE, IMM Backtesting), tasked with designing, developing and delivering functionalities. The role is within Solutions and Risk Technology area and will require interaction with the front office, credit risk (CRO IT), and product control areas, so communication as well as technical skills are important to succeed. The team is located in Wroclaw, London and New York. The system is based on the .NET Framework (C#, WWF, WCF), SQL Server and multiple internal technologies. You will work in the team of about 50 people including developers, BAs, QAs and support personnel. You will design and implement new functionalities in the EPE and IMM Backtesting projects. You will embrace interaction with business groups (e.g. quantitative analysts) and other IT teams. You will be responsible for ad-hoc system analysis and investigation - problem solving. You will understand the current applications and business processes, identify extensions and new functionality. You dream to learn the Fixed Income and Derivatives business. You will communicate design ideas and take part in peer reviews. While we will be primarily passionate about hiring a development team, applicants with specific experience in Support, QA, and Infrastructure will also be considered. Open to discussing flexible/agile working. You have a bachelor's degree in Computer Science, Engineering, Finance, Economics or a Mathematical Science is required You have at least 5 years of experience in Visual Studio, .NET Framework, C# You have experience in design and developing software for a large Enterprise, including n-tier architecture You have hands-on experience in programming multithreaded solutions You have solid knowledge of SQL Server and/or Oracle RDBMS knowledge Beneficial skills: Deep understanding of WWF and WCF would be a plus You have good analytical skills You have knowledge of Design Patterns For more information visit Technology Careers.  Our benefits Private medical care Life insurance Pension plan Charity days Training and development Internal Mobility Other optional Language training course Mentoring Family \xe2\x80\x93 nursery and kindergarten funding, gift vouchers for Christmas Parking allowance Health promotion: Multisport card, sporting events and groups within Credit Suisse (skiing trips, football team, running team, tennis training course etc.) Employee discounts on various products and services (event tickets, consumer products, etc.) Relocation package Employee Referral Program Flexible work schedule and working from home (home office)  If you apply for this role this means you agree with the following statement:  \xe2\x80\x9cThrough my application for a role with Credit Suisse (Poland) sp. z.o.o. (the Company) I hereby authorize the Company to process my personal data for the purposes of job recruitment. Furthermore I declare that I am aware of the voluntary submission of data and I am informed about the right to access the data and the right to correct it, pursuant to the Personal Data Protection Act of 29 August 1997 (Journal of Laws [Dz.U] No. 133, item 883)\xe2\x80\x9d. I authorize Company to process my personal data for future recruitment processes.  Furthermore, I authorize Credit Suisse Group AG and its\xe2\x80\x99 affiliates, Taleo (UK) Limited, cut-e AG Kleiner Burstah 12 and milch & zucker The Marketing & Software Company AG to process my personal data.  Credit Suisse and affiliates registration details.-  Credit Suisse (Poland) sp. z.o.o Registered office - 1 Icchoka Lejba Pereca street, 00 - 849 Warsaw Credit Suisse Group AG Registered office - Paradeplatz 8, 8001 Zurich, Switzerland and its\xe2\x80\x99 affiliates Taleo (UK) Limited Registered office - 78-586 Chiswick High Road, London W4 5RP, United Kingdom, Cut-e AG Kleiner Burstah 12 Registered office - 20457 Hamburg, Germany and Milch & Zucker The Marketing & Software Company AG Registered office - K\xc3\xbcchlerstra\xc3\x9fe 1, 61231 Bad Nauheim \xe2\x80\x9c"""
Other;Oracle Database Administrator;b'Oracle Database administrator required to work within the global database organization to provide a high level (Level 3 or higher) database expertise for day to day support of production and development environments.  Duties include: design and implement complex changes troubleshoot and solve incidents monitor and analyze performance issues work with numerous technical teams to improve core infrastructure DBA Support for application development and production support teams Overspill from Level 2 Global Sybase Team. Out of hours rota and weekend working as required. Weekend working will include RAC, Dataguard, GoldenGate replication setup duties within complicated, multiway heterogeneous replication environments, connecting to both Oracle and sybase Ensure compliance with operational / change management guidelines Support for application and infrastructure BCM tests perform L3/SME type of activities \xe2\x80\x93 complex High Availability and Disaster Recovery design and configuration, Advanced performance tuning and troubleshooting, Database administration The successful candidate must have an excellent track record of production support in a financial environment.'
Other;Oracle Database Developer or Engineer;b'As a member of the team you will have the opportunity to join a dynamic and exciting environment. Here there is the opportunity to learn multiple aspects of investment banking in an international team. The team of developers, analysts and engineers is globally distributed across New York, London, Singapore, Bangalore, Poland and Zurich. You will be focused on Oracle database and environement development and optimization, including coding in SQL, PL/SQL or supporting infrastructure streams reasponibsile for Oracle ecosystem in the company (design, deploy and operate). Data stored in databases is further used by systems responsible for collating, validating, aggregating and reporting data.  Oracle Developer will be responsible for: Developing and implementing new features and change requests in Oracle databases Monitoring database performance and tuning SQL queries and identifying and resolving scalability issues Developing and amending stored procedures and PL/SQL code to implement business logic He/she will also provide subject matter expertise and level 3 support to ensure the smooth running of systems and quick recovery from outages/downtime. Oracle Engineer will be responsible for: Providing L2 and L3 support on Oracle Databses Platform used within the Bank Desing and Creatre new solution for implementation within entire Oracle infrastructure (automatizition, scripting, tools, etc.) Preapre new Oracle platform version rollouts (including testing and documentation) Integrate standard Oracle platform within solution used in wider IT Infra environement (OS, storage, virtualization, security, etc.) Essential Proven track record in data modelling, delivering Oracle based solutions - SQL queries, PL/SQL code Expertise in ETL processes design and implementation, data lifecycle management Proven Oracle DB Operations/Administration skills Scripting in one of following language: perl, bash, ksh Strong written and oral communication skills. A self-starter who can proactively engage with peers and clients to ensure timely completion of deliverables. Desirable Understanding of financial products and risk management Experience of working on large projects / large and complex systems. Proficient in the use of the following: jira, MS Visio, MS Word, MS Excel, Enterprise Architect Unix/Linux or Windows System Administration background Some formal training and/or certifications in developing/architecting/engineering or administration on Oracle platform'
Backend;Senior Application Developer;"b""Position  Senior Application Developer  Project Description Department is looking to hire Mid-Senior Level JAVA developer to perform BAU work to support business/users. You will be expected to work as a member of the development team and participate in all aspects of software development lifecycle with a focus on Java Development using J2EE standards.  Responsibilities The ideal candidate will possess solid technical skills as well as the drive to learn more about the business and new technologies. Candidate should be open to work front to back in applications and must have sound grasp of development best practices and system architecture. Working with the QA team to ensure high quality outcomes. Developing, testing, and releasing new & enhanced application functionalities/feeds.  Skills Required Essentials Skills and Qualifications:  \xef\x90\x82 Experienced developer (5+ years minimum) in software development \xef\x90\x82 Primary skill sets - Java, Oracle, Linux, Messaging -TIBCO/EMS \xef\x90\x82 Knowledge and understanding of current best practices in Core Java and J2EE development \xef\x90\x82 Strong understanding of relational databases (writing SQL/Stored Procedures) \xef\x90\x82 Ability to use knowledge of MVC frameworks - Spring and/or Struts is required \xef\x90\x82 Excellent organizational, problem solving, and written/verbal communication skills. \xef\x90\x82 Experience with all phases of the systems development lifecycle \xef\x90\x82 Very thorough understanding of the Java technology fundamentals and design patterns used in real time transaction processing systems \xef\x90\x82 Demonstrates exceptional analytical and problem-solving skills \xef\x90\x82 Strong communication , organizational, and collaboration skills \xef\x90\x82 Bachelors or Master's Degree  Preferred Skills and Qualifications:  \xef\x90\x82 Oracle Coherence experience a plus \xef\x90\x82 JQuery, Drools, Spring a plus \xef\x90\x82 .NET experience a plus \xef\x90\x82 Understanding of the Fixed Income Credit domain a plus \xef\x90\x82 Good understanding of design patterns used in STP and Post Trading systems a plus"""
Other;Oracle Developer;b'Position  Oracle Developer  Project Description Compliance IT is a global organization within Corporate Services Technology business line that delivers legal and compliance solutions across the Client. It brings cross divisional expertise and regional best practices to a global delivery models. With the growth of responsibilities and functional coverage, department is looking for experienced solution integrator and developer to extend the Wroc\xc5\x82aw team. You will work in a team building and extending global solutions based on the Actimize Trade Surveillance and Nasdaq SMARTSBroker solutions.  Responsibilities Participation in complete solution delivery process starting from design till user acceptance and finally production deployment and initial support. Developing and implementing new features and change requests in Oracle databases. Designing, integrating & implementing solutions based on COTS vendor solutions or in-house built. Turning high level business requirements into technical solution. Eliciting, analyzing, documenting and validating business, functional and system requirements. Participation in the data ingestion design and implementation. Collaboration with functional process owners, technical experts, testing team and business analysts to ensure that business requirements are met within the provided solution. Opportunity to contribute to creation of technical standards and procedures used within the global delivery team.  Skills Required Essential skills: Practical experience with Oracle PL/SQL and data processing applications focused on data manipulations with any given technology. Expertise in ETL processes design and implementation, data lifecycle management, maintenance of batch loading processes based on flat files or any other technique. Practical experience with script languages as bash, perl (Linux platform) and PowerShell (Windows environment). Prior experience with any of mentioned is a strong plus to the role: BMC Control-M, test automation, continuous integration, Jenkins & Maven Experience in any of objective programming language having JAVA as preferred one. Desired skills: Abilities to troubleshoot issues on any component composing overall solution, execute root cause analysis and drive resolution of reported case with development and support teams. Working knowledge of XML, Xpath, XSL as well as working experience of Jira, SVN. Flexibility in moving across different technologies to deliver solution as required by given technology stack. Any prior involvement in test automation or test driven development, continuous integration and delivery is a strong plus for the role.'
Other;R&D Lab Engineer, IT Administrator;b'Nokia is a global leader in the technologies that connect people and things. With state-of-the-art software, hardware and services for any type of network, Nokia is uniquely positioned to help communication service providers, governments, and large enterprises deliver on the promise of 5G, the Cloud and the Internet of Things.  Serving customers in over 100 countries, our research scientists and engineers continue to invent and accelerate new technologies that will increasingly transform the way people and things communicate and connect.  General Purpose: System R&D and tools - Lab service delivery global team is looking for R&D Laboratory Engineer, Lab IT Administrator for Laboratory team in Wroclaw. As the content owner, operator and designer, the team enables and operates industry best-in-class R&D laboratories. Our team spread over globally with strength of 300 experts and is still growing. We are supporting more than 600 R&D projects globally with more than 800 Nokia products used to build network for 4G , IOT R&D testing and 5G product evaluation Main Responsibility Area: Overall responsibility of specified entities (e.g. features). Plans, designs and executes items in own area. Coordinates activities within own responsibility area. Has developed specialist knowledge in one area. Coaches other team members in solving basic engineering problems. Solves complex engineering problems of own technology area. Typically participates in reviews of own or neighboring projects. May undertake technical training responsibilities. Job Description: As an IT Linux Administrator in Laboratory Service Delivery team in Wroclaw, you will be responsible for: Administration and maintenance of Linux enterprise servers and services in heterogeneous environment. Administration of virtualization environment \xe2\x80\xa2 Proactive monitoring of systems and service architecture. Providing various custom services. Perform daily operations (e.g. Infrastructure monitoring, application support, and hardware and software maintenance) Create and maintain documentation as it relates to infrastructure, design, configuration, support and processes. Provide local support for efficient resolution of IT incidents, service requests and issues for R&D laboratory engineers. Implement best practices for new and existing solutions. Additional Requirements: Requirements: Good knowledge of Linux/Unix operating systems. Experience in best practices around the installation, configuration, upgrade, maintenance & monitoring of production Linux (Debian, RHEL/CentOS) servers. Good knowledge of TCP/IP networks (L2 and L3) and protocols. Solid understanding of virtual environments and experience using XENSERVER and KVM Experience with OpenStack environments deployment and administration - Experience with Ansible and Ansible Tower Experience in IT infrastructure and environment monitoring systems like as Cacti, Nagios, SNMP, PRTG - Good knowledge of storage technologies (LVM, RAID, SMART) Ability to implement custom-crafted/dedicated IT solutions. Demonstrated ability to generate and maintain technical documentation Good scripting skills in at least bash, python, ruby Strong technical and troubleshooting skills proficiency in English ability to learn quickly excellent communication skills Will be seen as a plus: Experience in Cisco switches and routers configuration. Experience in Netapp storage administration - CCNA or equivalent knowledge level VMware VCP or equivalent knowledge level - Experience with automated testing and continuous integration environments like Teamcity, Jenkins Good knowledge of server side technologies in e.g. Apache HTTPD, Tomcat, NGINX, MySQL, PostgreSQL, SSH, NFS, BIND, LDAP, SAMBA, FTP, OPENVPN, KERBEROS, SVN, GIT, PUPPET, IPTABLES, KICKSTART Familiarity with common server architecture and common vendors (DELL, HP, FUJITSU)'
Other;Regular Oracle Developer;b'Position  Regular Oracle Developer  Project Description Compliance IT is a global organization within Corporate Services Technology business line that delivers legal and compliance solutions across the Bank. It brings cross divisional expertise and regional best practices to a global delivery models. With the growth of responsibilities and functional coverage, department is looking for experienced solution integrator and developer to extend the Wroc\xc5\x82aw team. You will work in a team building and extending global solutions based on the Actimize Trade Surveillance and Nasdaq SMARTSBroker solutions.  Responsibilities Troubleshooting and maintenance of the solutions delivered onto production systems by implementation team. Close cooperation with development and production support team on issue resolution that includes root cause analysis, defects correction and patch installation. Development of the extensions to the existing data load and analysis automated processes Participation in solution deployment Participation in testing process including UAT support. Opportunity to contribute to creation of technical standards and procedures. Opportunity to expand responsibility towards implementation consultant / development role.  Skills Required Mandatory skills: Practical experience with Oracle PL/SQL and data processing applications focused on data manipulations with any given technology. Expertise in ETL processes design and implementation, data lifecycle management, maintenance of batch loading processes based on flat files or any other technique. Practical experience with script languages as bash, perl (Linux platform) and PowerShell (Windows environment). Prior experience with any of mentioned is a strong plus to the role: BMC Control-M, test automation, continuous integration, Jenkins & Maven Experience in any of objective programming language having JAVA as preferred one. Desired skills: Abilities to troubleshoot issues on any component composing overall solution, execute root cause analysis and drive resolution of reported case with development and support teams. Working knowledge of XML, Xpath, XSL as well as working experience of Jira, SVN. Flexibility in moving across different technologies to deliver solution as required by given technology stack. Any prior involvement in test automation or test driven development, continuous integration and delivery is a strong plus for the role.'
Other;Regular/Senior eForms Engineer;b'Position  Regular/Senior eForms Engineer  Project Description Records Management IT is a global technology change and delivery organization comprising nearly 150 individuals located in Switzerland, Poland, United Kingdom, United States and Singapore. We provide archiving and retrieval solutions to all business divisions focusing on supporting Legal, Regulatory and Operational functions.  The current technology stack comprises IBM CMOD, OpenText, Oracle, MSSQL, SAMFS, DB2, TSM, NETAPPS SNAPLOCK and various in-house created technologies coupled with Java/Scala/JavaScript, .Net, C#, Perl, Unix/Linux/Windows or Python.  Execution of eForms is a global function in a bank, key 8 engineers are located in Zurich. At least 5 new team members are needed in order to support / relive eForms design team from Switzerland. Approx. 6500 forms need to be maintained and approx. 400 forms are created newly each year. Several large projects are coming during the year (e.g. FATCA/AIA, Card banking or MiFiD) with small processing windows. Two different technologies are used at the time: Dynamic forms created with LiveCycle containing complex JavaScript scripting Less / Non-dynamic forms via Adobe Experience Manager, consisting of physical form and schema file for field binding  Responsibilities Successful candidate would be part of a design team and responsible for processing bulk work related to initial form design according to guidelines and/or textual changes Review requirement specification & configurations to identify gaps and discrepancies, ensure that technical requirements of the system are addressed in order to successfully process documents. Perform testing, conduct root cause analysis of test defects, implement fixes, conduct test scenarios walk through with Source IT teams Produce production handover document, participate in post-production verification checks  Skills Required Experience in Adobe Pro/Adobe Life Cycle or AEM Designer, Scripting Knowledge (Java Script/Perl) and basic knowledge of XML/Git Typographic/graphic knowledge Able to meet deadlines while working independently within given instructions Able to perform under time pressure and high workload Conceptual thinking Very good English language skills a must, German desirable, any other language is an advantage Very well organized, with a sense of how to prioritize and to shape efficient processes A team player who is energetic with positive can-do attitude Client focused and problem solver'
Other;Security Software Configuration Developer;"b""TIS Global Products and Services (\xe2\x80\x9cGPS\xe2\x80\x9d) is Credit Suisse's IT infrastructure engineering organization. GPS is responsible for lifecycle management and engineering of all current and future infrastructure products, platforms and services. GPS also oversees technology programs maximizing both fulfillment of business requirements and value of the product portfolio. We offer a state-of-the-art smart working office environment and promote flexible working. The Wroclaw Center of Excellence TIS GPS team is significantly strengthening its presence with various new IT Infrastructure Engineering roles. We are now recruiting 100 people for almost all IT infrastructure domains and expect to expand even more within the next two years. Join us to shape the next generation of IT Infrastructure at Credit Suisse, one of the leading global banks! The role of a Security Software Configuration Developer will support our GPS Secure & Control Engineering team to design, engineer and configure the firms strategic log management solution based on a product called Splunk. This also requires collaboration with the third party vendor. This Poland based role will serve and closely collaborate in a global context. Success will be defined by the level of contribution to the following areas: Customize software packages provided by the vendors Develop software packages for automated deployment and migration Develop configuration code for system components Design test scripts and perform unit tests of customized software packages Participate in integration and UAT tests Provide 3rd level support to fix issues on production environments Collaborate internally with team colleagues, other teams, Project and Product Managers (based in Switzerland and other locations) Collaborate externally with product vendors (e.g. Splunk, Tripwire) Required: Higher degree in IT or relevant working experience Working hands-on experience in: Application or configuration development in complex environments Coding in Python, or VBScript, Powershell, bash, etc. Good understanding of IT infrastructure as well as IT security domains Good communication skills in English (written and spoken) Personal skills and competencies: Ability to communicate and collaborate with people from different cultural background Ability to act as a team player and work independently in a global enterprise Conceptual and analytical skills, creativity and persistency Passion for development Desirable: Awareness of phased SDLC processes Experience in: Unit and integration testing 3rd level production support Programming in Object Oriented Languages (e.g. .NET, JAVA, C , etc.) Source code version control system (e.g. SVN) Packaging tools (e.g. rpm, Blade logic) Knowledge of the following security monitoring tools or equivalent technologies: Security Compliance Monitoring tools (e.g. Tripwire) Log Management tools (e.g. Splunk) If you apply for this role this means you agree with the following statement:  \xe2\x80\x9cI hereby authorize Credit Suisse (Poland) sp. z o.o. (Company) with its\xe2\x80\x99 registered seat at 1 Rondo ONZ street, 00-124 Warsaw to process my personal data for the purposes of job recruitment. Furthermore I declare that I am aware of the voluntary submission of data and I have been informed about the right to access the data and the right to correct it, pursuant to the Personal Data Protection Act of 29 August 1997 (Journal of Laws [Dz.U] No. 133, item 883)\xe2\x80\x9d. I do authorize Company to process my personal data for future recruitment processes. I furthermore authorize Credit Suisse Group AG with its\xe2\x80\x99 registered seat at Paradeplatz 8, 8001 Zurich, Switzerland and its\xe2\x80\x99 affiliates, Taleo (UK) Limited with its\xe2\x80\x99 registered seat at 578-586 Chiswick High Road, London W4 5RP, United Kingdom, cut-e AG Kleiner Burstah 12 with its\xe2\x80\x99 registered seat at 20457 Hamburg, Germany and milch & zucker The Marketing & Software Company AG with its\xe2\x80\x99 registered seat at K\xc3\xbcchlerstra\xc3\x9fe 1, 61231 Bad Nauheim, Germany to process my personal data.\xe2\x80\x9d"""
