category;position;description
Support;IT Service Desk Analyst - Italian/ Spanish/ French/ German Speaker;b'Service Desk Analyst will provide first level support for the workspace area to all Credit Suisse employees requesting help. All users use the same desktop infrastructure platform, standard hardware and are part of the same Active Directory domain. A set of tools will be provided to interact with clients via each support channel. Analyst will be trained in operation and administration of the Credit Suisse tools. These include an request/incident management system, knowledge management, remote control tools and software support tools. Service Desk Analyst will be required to become proficient in each of these technologies. She/he needs to show first-class communication and team player skills at all levels, engagement in the daily work, willingness to learn and focus on results. It\xe2\x80\x99s definitely a key factor for Analyst to be motivated to work in international and multicultural environment where the dedication to high quality service is a must. A membership of Global Service Desk Team means being responsible for assigned tasks as well as concentrated on constant improving own and the Team\xe2\x80\x99s skills. Accepts and logs authorized calls by phone, web, mail, or other authorized means Categorizes and prioritizes all incidents and service requests arriving on the Global Service Desk queue, either resolving them directly or re-assigning them to other support teams as required Updates existing incidents and requests records active in the incident management system Understands service levels and executes tasks accordingly Provides internal and external communication of incident/request status, engaging next level support when required Coordinates incident resolution and service request completion with various workgroups Ensures phone coverage in shift patterns Provide all internal clients with a dedicated, positive and efficient service at all times Adherence to process and procedures to maintain quality and professionalism Cooperate with partners located over the whole globe IT Service Desk skills and qualifications: Bachelor\xe2\x80\x99s degree or equivalent work experience Excellent verbal and written communication skills Contagious enthusiasm fueled by a desire to be best in class Innovative and prepared to try different ideas where this could be beneficial to the environment and our clients Fluent written / spoken English and French / German / Italian / Spanish Ability to work under pressure, to keep things simple, patience and creativity, conflict management skills Demonstrate a high level of customer focus and empathy Solid Teamwork and communication / information sharing Willingness to learn and focus on results Client focused and biased in pursuit of business goals and objectives For more information visit Technology Careers If you apply for this role this means you agree with the following statement:  \xe2\x80\x9cThrough my application for a role with Credit Suisse (Poland) sp. z.o.o. (the Company) I hereby authorize the Company to process my personal data for the purposes of job recruitment. Furthermore I declare that I am aware of the voluntary submission of data and I am informed about the right to access the data and the right to correct it, pursuant to the Personal Data Protection Act of 29 August 1997 (Journal of Laws [Dz.U] No. 133, item 883)\xe2\x80\x9d. I authorize Company to process my personal data for future recruitment processes.  Furthermore, I authorize Credit Suisse Group AG and its\xe2\x80\x99 affiliates, Taleo (UK) Limited, cut-e AG Kleiner Burstah 12 and milch & zucker The Marketing & Software Company AG to process my personal data.  Credit Suisse and affiliates registration details.-  Credit Suisse (Poland) sp. z.o.o Registered office - Rondo ONZ street, 00-124 Warsaw Credit Suisse Group AG Registered office - Paradeplatz 8, 8001 Zurich, Switzerland and its\xe2\x80\x99 affiliates Taleo (UK) Limited Registered office - 78-586 Chiswick High Road, London W4 5RP, United Kingdom, Cut-e AG Kleiner Burstah 12 Registered office - 20457 Hamburg, Germany and Milch & Zucker The Marketing & Software Company AG Registered office - K\xc3\xbcchlerstra\xc3\x9fe 1, 61231 Bad Nauheim \xe2\x80\x9c'
Backend;Back End Developer (Node.js), New Ventures;b'You will join a Scrum team working in a start-up environment, building new software as a service solutions, using latest technologies such as Node.js, React, html5, and enjoy seeing the direct impact from your work.  You will work alongside with very senior Node and React developers which gives you an unparalleled learning opportunity.  You will build new solutions as well as help bring existing solutions to product-market-fit and scale. You will help architect web applications that are modular, stable, secure, and scalable. You will apply and champion latest best-practices and tools, such as CI, CD, Git, Agile development, micro-services etc.  You will focus on building back-end Node.js microservices and well-defined REST APIs.  You will help build a team of web developers which is set to grow sizeably over the coming years.'
Backend;Backend Developer;b'We are looking for someone to join the Wealth Management Americas (WMA) Technology team to focus on the new multi-year technology initiative to revamp and enhance our Field Technology platform. It is a development tech role that entails working with teams in US and Hungary, and other partner teams in multiple geographic locations around the world. In this role, you will be responsible for: Design of the overall architecture of web application for delivering on the business needs Implementation of a robust set of services and APIs to power the web application Building reusable code and libraries for future use Optimization of the application for maximum speed and scalability Implementation of security and data protection Translation of UI/UX wireframes to visual elements Integration of the front-end and back-end aspects of the web application'
Devops;Dev Ops Engineer;b'Dev Ops Engineer - Wroclaw, Poland  Eagle Investment Systems is currently seeking an experienced developer to join our growing Cloud Engineering team. The individual will have the skills and experience to work closely with several teams across a vast array of business and technical verticals. We are looking for a well-rounded professional with a passion for emerging technologies.  Responsibilities: Gain proficiency with current Eagle software stack, including automation, orchestration and applications , and proactively improve them Drive enhancements throughout full life cycle from concept to final implementation Assist in the creation and enhancement of coding standards and development best practices Participate and provide insight in the development of future Enterprise solutions Design, build, deploy and support tools and platforms within the Eagle Cloud Platform Qualifications Strong proficiency with Linux/Unix OS, including system design and troubleshooting Strong proficiency in Java Excellent communication skills (written and verbal) Open to being challenged and willing to continuously learn and improve Excellent technical and analytical skills Good Computer Science fundamentals (i.e. design patterns, data structures, etc.) Experience working in an Agile/Scrum development process Experience with Relational Databases (Oracle, MySQL) and NoSQL Databases (MongoDB) Experience with automation and configuration management tools - puppet, ansible, saltstack, chef A solid understanding of networking and core Internet protocols (e.g. TCP/IP, DNS, SMTP, HTTP, and distributed networks). Experience writing automation test code and scripting (Python, Perl, Shell , etc.) Understanding of REST APIs Experience with any of the following tools a plus: GIT, TFS, Jira, Service Now, Jasmine, Jenkins Comfortable working in a collaborative team and technology community Financial industry experience combined with software industry experience is a plus Demonstrated track record of contributing successfully to the delivery of large and visible, high quality projects Ability to work and communicate effectively with remote teams Must possess degree educated in a science discipline and must be genuinely interested in the core technologies that underpin modern software development (Computer Science/Computer Engineering degree preferred). Please send us your resume and a brief cover letter describing your strengths and why you think you\xe2\x80\x99d be a good fit for our team to careers@eagleinvsys.com.'
Business Intelligence;Big Data Engineer (Spark&Scala);"b'Striving for excellence is in our DNA. Since 1993, we have been helping the world\xe2\x80\x99s leading companies imagine, design, engineer, and deliver software and digital experiences that change the world. We are more than just specialists, we are experts.  DESCRIPTION Currently we are looking for a Big Data Engineer (Spark&Scala) for our Wroclaw office to make the team even stronger.  We are seeking a qualified candidate who has quick learning abilities, committed to following through and delivering high results, who has a passion to learn new tools, technologies and industry trends. Responsibilities Design and implement production Big Data environments using modern technologies, Work with the team on modelling complex relationships in heterogeneous data environments, Build, validate and optimize large-scale, corporate-wide Big Data solutions, Work with business stakeholders to translate their data/reporting needs to algorithms, analyses and reports. Requirements Bachelor\xe2\x80\x99s degree in Computer Science or a related technical field, or equivalent work experience, At least 1 year of Scala programming experience, Knowledge of Big Data technologies and hands-on experience, Experience in Spark, Experience in NoSQL databases, Experience in development on Linux platform, Experience in Agile methodologies, Analytical and problem solving skills, Good communication skills, Good spoken and written English. Nice to have Experience in Cassandra. We offer Possibility to be involved in an international project (Canada, China, Hong Kong, Mexico, USA, Switzerland, Germany, Sweden, United Kingdom, Russia, Belarus, Ukraine, Hungary, etc.), Language classes (English and Polish), Vast opportunities for self-development: online courses and library, experience exchange with colleagues around the world, partial grant of certification, Career development center, Possibility to take part in both: corporate and startup environment, Possibility to relocate for short and long-term projects, Relocation package for those who relocates to Krakow, Wroclaw, or Gdansk from other locations, Benefit package (health care, multisport, lunch tickets, petrol vouchers and shopping vouchers, etc.), Fruits on a weekly basis, Sponsored sport activities, E-sport program, We kindly ask you to include the following clause in your application: ""Wyra\xc5\xbcam zgod\xc4\x99 na przetwarzanie moich danych osobowych zawartych w mojej ofercie pracy dla potrzeb niezb\xc4\x99dnych do realizacji procesu rekrutacji zgodnie z ustaw\xc4\x85 z dnia 29 sierpnia 1997 r. o ochronie danych osobowych (Dz. U. z 2002 r. Nr 101, poz. 926, ze zm.)"", Please note that only selected candidates will be contacted.'"
Backend;C DSP Embedded Engineer;b'Daily activities:  You will be responsible for software design, implementation, analyzing and solving complex engineering problems and hitches in radio technologies area. You will create and review requirements for functional, design and interface specifications based on system and HW specifications. Your scope of work will include daily cooperation with project managers in planning activities.  We work with:  \xc2\xb7 C 11/14/17  \xc2\xb7 GCC, Clang  \xc2\xb7 Linux  \xc2\xb7 ARM/DSP processors  \xc2\xb7 Linux or embedded RTOS  \xc2\xb7 Yocto/Bitbake  \xc2\xb7 Testing frameworks  \xc2\xb7 JIRA  \xc2\xb7 Version control and code review systems  \xc2\xb7 Continuous integration systems  Our expectations:  \xc2\xb7 Master\xe2\x80\x99s or Bachelor\xe2\x80\x99s degree in Engineering, Telecommunications, Computer Science, Software Technology or equivalent education  \xc2\xb7 excellent coding skills  \xc2\xb7 expertise in algorithm optimization, code profiling and in analysis of memory usage violations  \xc2\xb7 experience in creating multi-core embedded projects  \xc2\xb7 Real time operating systems knowledge  \xc2\xb7 Python/Bash is an advantage  \xc2\xb7 analytical thinking  \xc2\xb7 teamwork skills  \xc2\xb7 good communication in English (both written and spoken)  \xc2\xb7 ready to relocate to Wroclaw, living in or nearby'
Project Manager;IT Delivery Manager;"b""Are you a solid IT manager with hands on agile software delivery experience? Do you have the courage to challenge the status quo while making sure your hard pressed team makes its deliveries?  We're looking for someone who may: manage software delivery teams look after the team through motivation, career development, and retention take part in the recruitment process to build up the team identify infrastructure issues or other inefficiencies in the environment and drive solutions drive implementation of key processes across teams (requirements and change management, acceptance criterion, continuous integration, delivery quality standards, fine tuning to agile approach) ensure sharing of best practices/business domain knowledge/exploiting synergies between teams"""
Project Manager;IT Project Management;b'When you join Credit Suisse as a Project Manager you\xe2\x80\x99ll have the perfect platform from which to build first-class expertise \xe2\x80\x93 and a career to match. You\xe2\x80\x99ll do that by project managing changes to banking system, e.g. risk and reporting system applications and will be responsible for the functional verification of delivered features. Best of all, you\xe2\x80\x99ll work with the kind of leading edge technologies you\xe2\x80\x99ll only find from an Investment and Private bank that\xe2\x80\x99s leading the industry.  As a Project Manager your main responsibilities will involve: Balancing the complexities of a business critical project \xe2\x80\x93 developing metrics and sharing milestones with all relevant parties Working on an agile basis with worldwide teams to define the best way to deliver it Developing an innovative approach to IT project management Negotiating and prioritizing individual development pieces and ad hoc analysis work A proven track record in Project Manager role Good IT knowledge A methodical, analytical approach to problem solving The flexibility to work individually, in a team, across teams and around project management methodologies The confidence to build relationships with clients, colleagues, managers and business users The ability to take ownership of issues and follow to resolution Familiarity with formal Project Management methodologies such as PMP or Prince2'
Backend;C Engineer;b'Nokia is a global leader in the technologies that connect people and things. With state-of-the-art software, hardware and services for any type of network, Nokia is uniquely positioned to help communication service providers, governments, and large enterprises deliver on the promise of 5G, the Cloud and the Internet of Things.  Serving customers in over 100 countries, our research scientists and engineers continue to invent and accelerate new technologies that will increasingly transform the way people and things communicate and connect.  Daily activities:   You will be responsible for software design, implementation, analyzing and solving complex engineering problems and hitches in radio technologies area. You will create and review requirements for functional, design and interface specifications based on system and HW specifications. Your scope of work will include daily cooperation with project managers in planning activities.  We work with: C 11/14/17 GCC, Clang Linux Yocto/Bitbake Testing frameworks JIRA Version control and code review systems Continuous integration systems Master\xe2\x80\x99s or Bachelor\xe2\x80\x99s degree in Engineering, Telecommunications, Computer Science, Software Technology or equivalent education strong coding skills expertise in algorithm optimization, code profiling and in analysis of memory usage violations analytical skills Python/Bash is an advantage analitical thinking teamwork skills good communication in English (both written and spoken) ready to relocate to Wroclaw, living in or nearby'
Frontend;Front End Developer (React), New Ventures;b'You will join a Scrum team working in a start-up environment, building new software as a service solutions, using latest technologies such as React, Node.js, html5, and enjoy seeing the direct impact from your work.  You will work alongside with very senior Node and React developers (10+ years) which gives you an unparalleled learning opportunity.  You will build new solutions as well as help bring existing solutions to product-market-fit and scale. You will architect web applications that are modular, stable, secure, and scalable. You will apply and champion latest best-practices and tools, such as CI, CD, Git, Agile development, micro-services etc.  You will bring a user-centric mindset to the team and work with a keen eye for design and UX.  You will help build a team of web developers which is set to grow sizeably over the coming years.'
Backend;C# Developer;b'The system is composed of a risk engine and a data warehouse in which underlying securities are maintained and enriched with information from internal and external data providers  A challenging role as a Senior C# Developer in a demanding business (Risk Management) and technical (Data Mgt., DWH) environment. Duties and responsibilities include: Implementation of new requirements, with particular focus on scalability and performance Interaction with requirements engineers, project managers, and business experts Participation in prioritization and packaging of scope Solution supports business needs and strategy according to agreed priorities Open to discussing flexible/agile working. LI-AT1*  Several years of experience with the .NET framework and C# Deep knowledge of WCF, Entity Framework, ADO.NET, T-SQL Knowledge of Silverlight, WPF recommended Experience in implementing multithreaded applications Experience in implementing web services with WCF or WebApi Microsoft certification recommended Strong analytical and conceptual thinking Significant experience with the design, development and maintenance of enterprise data systems Experienced practitioner of development methodologies, standards and procedures with strong skills in data modeling Excellent written and verbal communication Ability to multi-task in complex environment For more information visit Technology Careers  If you apply for this role this means you agree with the following statement:  \xe2\x80\x9cThrough my application for a role with Credit Suisse (Poland) sp. z.o.o. (the Company) I hereby authorize the Company to process my personal data for the purposes of job recruitment. Furthermore I declare that I am aware of the voluntary submission of data and I am informed about the right to access the data and the right to correct it, pursuant to the Personal Data Protection Act of 29 August 1997 (Journal of Laws [Dz.U] No. 133, item 883)\xe2\x80\x9d. I authorize Company to process my personal data for future recruitment processes.  Furthermore, I authorize Credit Suisse Group AG and its\xe2\x80\x99 affiliates, Taleo (UK) Limited, cut-e AG Kleiner Burstah 12 and milch & zucker The Marketing & Software Company AG to process my personal data.  Credit Suisse and affiliates registration details.-  Credit Suisse (Poland) sp. z.o.o Registered office - Rondo ONZ street, 00-124 Warsaw Credit Suisse Group AG Registered office - Paradeplatz 8, 8001 Zurich, Switzerland and its\xe2\x80\x99 affiliates Taleo (UK) Limited Registered office - 78-586 Chiswick High Road, London W4 5RP, United Kingdom, Cut-e AG Kleiner Burstah 12 Registered office - 20457 Hamburg, Germany and Milch & Zucker The Marketing & Software Company AG Registered office - K\xc3\xbcchlerstra\xc3\x9fe 1, 61231 Bad Nauheim\xe2\x80\x9d'
Testing;Business Intelligence Testing Specialist;b'As Business Intelligence Testing Specialist you will be responsible for ensuring the quality of tools that enable Volvo Group to take strategic business decisions. You\xe2\x80\x99ll have an opportunity to work with the combination of software applications, methodologies and business systems that play a key role in the strategic planning process of the Volvo Group. Moreover you will be the leader introducing quality assurance principles in dynamically growing BI department.  Main responsibilities: Cooperate with business representative and IT management to specify and agree on the scope of testing Ensure test requirements are reviewed, clear and testable Create and maintain test cases and test scenarios Ensure all defects are correctly reported, analyzed, assigned or escalated when needed Support during User Acceptance Testing Coaching junior testers Performing on-the job trainings Required competencies: Excellent communication skills Very good English skills Minimum 4 years of testing experience (as clear Quality Engineer or BI developer performing tests) Practical experience with Enterprise Data Warehouse tests or BI Front-end tests (preferably both) Strong knowledge of relational databases (MS SQL, Oracle) Good knowledge of test methodologies (ISTQB certificates) Nice to have: Experience as BI developer Experience with Data Quality, Data Mining Experience with Agile/Scrum methodology Stakeholder management skills Presentation skills What makes us special? Collaborative environment in Swedish organizational culture Responsible and challenging tasks with access to the latest tools and technology Partnership with professionals, identified career paths including global opportunities International projects in company with certain recognition on the market Comprehensive introduction training package with mentor\xe2\x80\x99s support Friendly workplace: modern campus with many facilities \xe2\x80\x93 medical center, restaurant, lunch rooms, sport/leisure area (football, basketball, tennis) This recruitment is in scope of Referral Program.  We work together with energy, passion and respect for the individual!'
Backend;C/C++ Developer;b'Position  C/C++ Developer  Project Description Performance optimization of GPU compute libraries for recent GPU using OpenCL. Port and optimization of libraries from CUDA to OpenCL. System-level performance measurement and benchmarking.  Responsibilities Work close with customer engineering team. Develop new version of high-performance GPU compute libraries for newest generation of GPU. Porting and maintenance of existing code. Development new benchmark tools and performance monitors.  Skills Required Optimization of OpenCL kernels for specific GPU architecture Work with Kernel mode device driver Linux and Windows platform internals, kernel mode development and debugging Applications for HPC, Geo, Gaming, etc.'
